{
  "metadata": {
    "capsule_id": "capsule.example.note.v1",
    "version": "1.0.0",
    "status": "draft",
    "type": "operations",
    "subtype": "atomic",
    "author": "egor-n1",
    "created_at": "2026-03-26T12:00:00Z",
    "updated_at": "2026-03-26T12:00:00Z",
    "name": "Example Note Capsule",
    "semantic_hash": "example-note-capsule-public-specs-valid-reference-shape",
    "source": {
      "uri": "https://github.com/num1hub/capsule-specs/examples/example-note.capsule.json",
      "type": "generated_public_example"
    }
  },
  "core_payload": {
    "content_type": "markdown",
    "content": "# Example Note\n\nThis example note demonstrates the smallest public-safe capsule shape for narrative content. It is intentionally simple so humans and tools can inspect the structure without needing access to private vault data."
  },
  "neuro_concentrate": {
    "summary": "This example capsule shows a minimal note-shaped capsule that still respects the full five-element outer structure used by CapsuleOS. It is designed for public documentation, schema consumers, and validator smoke checks. The payload stays intentionally small, but the example still demonstrates semantic hash parity, confidence-vector structure, and the presence of a recursive layer even when no graph links are required yet. Readers can use it as a human-friendly reference, while tooling can use it as a stable sample when building import, parsing, validation, and rendering experiments against the public N1Hub specification surface.",
    "keywords": [
      "example",
      "note",
      "capsule",
      "capsuleos",
      "reference",
      "validation",
      "public-specs"
    ],
    "confidence_vector": {
      "extraction": 1,
      "synthesis": 1,
      "linking": 0.94,
      "provenance_coverage": 1,
      "validation_score": 1,
      "contradiction_pressure": 0
    },
    "semantic_hash": "example-note-capsule-public-specs-valid-reference-shape"
  },
  "recursive_layer": {
    "links": [],
    "epistemic_ledger": []
  },
  "integrity_sha3_512": "fa282f90d323024889dec453ea5b470abfeec6f6a4a2b37dbdffd3761b6f335a87b0132f3dd3c9ef2773f273e40a429bbe05eb0decc0143c0e655bfc31d60ce7"
}
