{
  "metadata": {
    "capsule_id": "capsule.example.task.v1",
    "version": "1.0.0",
    "status": "draft",
    "type": "operations",
    "subtype": "atomic",
    "author": "egor-n1",
    "created_at": "2026-03-26T12:00:00Z",
    "updated_at": "2026-03-26T12:00:00Z",
    "name": "Example Task Capsule",
    "semantic_hash": "example-task-capsule-public-specs-valid-reference-shape",
    "source": {
      "uri": "https://github.com/num1hub/capsule-specs/examples/example-task.capsule.json",
      "type": "generated_public_example"
    }
  },
  "core_payload": {
    "content_type": "json",
    "content": "{\n  \"kind\": \"task\",\n  \"title\": \"Review CapsuleOS public examples\",\n  \"status\": \"queued\",\n  \"priority\": \"high\",\n  \"labels\": [\"example\", \"task\", \"public-specs\"]\n}"
  },
  "neuro_concentrate": {
    "summary": "This example capsule demonstrates how an operational task can be represented without changing the outer law of the capsule model. The inner payload is small and intentionally generic, but the complete object still shows the validator-friendly shape expected by CapsuleOS. It is useful for public reference docs, CLI smoke checks, and downstream tooling that needs one compact task sample while remaining independent from private operator data. Because the capsule stays in draft status and carries no graph links, it is easy to validate in isolation while still expressing the same structural discipline as richer production capsules.",
    "keywords": [
      "example",
      "task",
      "capsule",
      "operations",
      "reference",
      "validator",
      "public-specs"
    ],
    "confidence_vector": {
      "extraction": 1,
      "synthesis": 1,
      "linking": 0.94,
      "provenance_coverage": 1,
      "validation_score": 1,
      "contradiction_pressure": 0
    },
    "semantic_hash": "example-task-capsule-public-specs-valid-reference-shape"
  },
  "recursive_layer": {
    "links": [],
    "epistemic_ledger": []
  },
  "integrity_sha3_512": "91e1ca5c74b79ecb30e1980e93de4d9b4691972bf05ce7bee7e585afd2945cbd0d8e95f9154f40230a6842a81390cdc28928ce96f422fe859e2471e83035e1e3"
}
